{
  "schemaVersion": 1,
  "generatedAt": "2026-06-20T14:00:00Z",
  "theme": {
    "colors": {
      "bg": "#0b1020", "bgAccent": "#16204a", "cardBg": "#161c2e",
      "textPrimary": "#f2f5ff", "textSecondary": "#9aa4c4", "accent": "#6ea8fe",
      "up": "#43d18a", "down": "#ff6b6b", "divider": "#2a3350"
    },
    "fonts": { "family": "-apple-system, system-ui, sans-serif" },
    "spacing": 12, "radius": 20
  },
  "nav": [
    { "title": "Home", "icon": "house.fill", "path": "/__APP_NAME_LOWER__" },
    { "title": "Location", "icon": "map.fill", "children": [
      { "title": "Activity", "icon": "map.fill", "path": "/screen/afm" }
    ] },
    { "title": "Config", "icon": "slider.horizontal.3", "path": "/screen/config" }
  ],
  "data": {
    "meta": { "updatedAtFormatted": "Updated just now", "stale": false },
    "known": {
      "title": "Label location",
      "subtitleFormatted": "Save 40.4862, -74.4518 as a known place",
      "fields": [
        { "key": "name", "value": "Home", "type": "string", "label": "Name" },
        { "key": "latitude", "value": "40.486200", "type": "float", "label": "Latitude" },
        { "key": "longitude", "value": "-74.451800", "type": "float", "label": "Longitude" },
        { "key": "radius_m", "value": "150", "type": "int", "label": "Radius (m)" }
      ],
      "locs": [
        { "name": "Gym", "metaFormatted": "40.5000, -74.4700 · 100m" },
        { "name": "Office", "metaFormatted": "40.5354, -74.4957 · 200m" }
      ],
      "countFormatted": "2 known locations",
      "backHref": "/screen/afm"
    }
  },
  "screen": {
    "type": "screen",
    "style": { "background": "$bg" },
    "children": [
      {
        "type": "scroll",
        "children": [
          {
            "type": "vstack",
            "style": { "spacing": 12, "padding": 16 },
            "children": [
              {
                "type": "hstack",
                "style": { "align": "center" },
                "children": [
                  { "type": "text", "binding": "known.title", "style": { "font": "largeTitle", "weight": "bold", "color": "$textPrimary" } },
                  { "type": "spacer" },
                  { "type": "text", "props": { "text": "Activity" }, "style": { "font": "caption", "weight": "semibold", "color": "$accent" }, "action": { "type": "navigate", "urlBinding": "known.backHref" } }
                ]
              },
              { "type": "text", "binding": "known.subtitleFormatted", "style": { "font": "caption", "color": "$textSecondary" } },
              { "type": "text", "binding": "known.error", "style": { "font": "caption", "color": "$down" } },
              {
                "type": "card",
                "style": { "background": "$cardBg", "cornerRadius": 20, "padding": 16 },
                "children": [
                  {
                    "type": "vstack",
                    "props": { "repeat": "known.fields" },
                    "children": [
                      { "type": "field", "binding": "item" }
                    ]
                  }
                ]
              },
              {
                "type": "button",
                "props": { "text": "Save location" },
                "action": { "type": "submit", "url": "/known_locs" }
              },
              { "type": "text", "binding": "known.countFormatted", "style": { "font": "headline", "weight": "semibold", "color": "$textPrimary" } },
              {
                "type": "vstack",
                "props": { "repeat": "known.locs" },
                "style": { "spacing": 8 },
                "children": [
                  {
                    "type": "card",
                    "style": { "background": "$cardBg", "cornerRadius": 14, "padding": 12 },
                    "children": [
                      {
                        "type": "hstack",
                        "style": { "align": "center", "spacing": 8 },
                        "children": [
                          { "type": "image", "props": { "name": "star.fill" }, "style": { "color": "#ffd166" } },
                          { "type": "text", "binding": "item.name", "style": { "font": "body", "weight": "semibold", "color": "$textPrimary" } },
                          { "type": "spacer" },
                          { "type": "text", "binding": "item.metaFormatted", "style": { "font": "caption", "color": "$textSecondary" } }
                        ]
                      }
                    ]
                  }
                ]
              }
            ]
          }
        ]
      }
    ]
  }
}
