{
  "schemaVersion": 1,
  "generatedAt": "2026-06-20T14:00:00Z",
  "theme": {
    "colors": {
      "bg": "#0b1020", "bgAccent": "#16204a", "cardBg": "#161c2e",
      "textPrimary": "#f2f5ff", "textSecondary": "#9aa4c4", "accent": "#6ea8fe",
      "up": "#43d18a", "down": "#ff6b6b", "divider": "#2a3350"
    },
    "fonts": { "family": "-apple-system, system-ui, sans-serif" },
    "spacing": 12, "radius": 20
  },
  "nav": [
    { "title": "Home", "icon": "house.fill", "path": "/__APP_NAME_LOWER__" },
    { "title": "Location", "icon": "map.fill", "children": [
      { "title": "Activity", "icon": "map.fill", "path": "/screen/afm" },
      { "title": "48h Transactions", "icon": "clock.arrow.circlepath", "path": "/screen/afm48" }
    ] },
    { "title": "Balances", "icon": "dollarsign.circle.fill", "path": "/screen/balances" },
    { "title": "Budget", "icon": "chart.pie.fill", "path": "/screen/budget" },
    { "title": "Smart Home", "icon": "house.circle.fill", "path": "/screen/smarthome" },
    { "title": "Messages", "icon": "message.fill", "path": "/screen/messages" },
    { "title": "System", "icon": "wrench.and.screwdriver.fill", "children": [
      { "title": "Logs", "icon": "doc.text.fill", "path": "/screen/logs" },
      { "title": "Repos", "icon": "chevron.left.forwardslash.chevron.right", "path": "/screen/repos" },
      { "title": "Schedrunner", "icon": "timer", "path": "/screen/schedrunner" },
      { "title": "Sched Logs", "icon": "doc.text.magnifyingglass", "path": "/screen/schedlogs" },
      { "title": "BQ Tables", "icon": "tablecells", "path": "/screen/bqtables" }
    ] },
    { "title": "Docs", "icon": "folder.fill", "path": "/screen/docs" },
    { "title": "Config", "icon": "slider.horizontal.3", "path": "/screen/config" }
  ],
  "data": {
    "meta": { "updatedAtFormatted": "Updated just now", "stale": false },
    "budget": {
      "title": "Budget",
      "subtitleFormatted": "Avg monthly spending · last 12 full months · Jun 2025 – May 2026",
      "totalAvgFormatted": "$6,250.00/mo",
      "windowFormatted": "Jun 2025 – May 2026",
      "emptyFormatted": "",
      "buckets": [
        { "title": "Essential", "subtotalFormatted": "$3,900.00/mo", "subtotalDirection": "up", "countFormatted": "3 categories", "categories": [
          { "name": "Rent", "avgFormatted": "$2,000.00/mo", "rangeFormatted": "$2,000.00 – $2,000.00", "direction": "up" },
          { "name": "Groceries", "avgFormatted": "$1,100.00/mo", "rangeFormatted": "$820.00 – $1,440.00", "direction": "up" },
          { "name": "Utilities", "avgFormatted": "$800.00/mo", "rangeFormatted": "$610.00 – $980.00", "direction": "up" }
        ] },
        { "title": "Shared", "subtotalFormatted": "$650.00/mo", "subtotalDirection": "up", "countFormatted": "1 category", "categories": [
          { "name": "Shared Household", "avgFormatted": "$650.00/mo", "rangeFormatted": "$500.00 – $900.00", "direction": "up" }
        ] },
        { "title": "Goals", "subtotalFormatted": "$900.00/mo", "subtotalDirection": "up", "countFormatted": "1 category", "categories": [
          { "name": "Vacation Fund", "avgFormatted": "$900.00/mo", "rangeFormatted": "$0.00 – $1,800.00 · ~$10,800/yr projected", "variable": true, "annualFormatted": "~$10,800/yr", "direction": "up" }
        ] },
        { "title": "Lifestyle", "subtotalFormatted": "$800.00/mo", "subtotalDirection": "up", "countFormatted": "2 categories", "categories": [
          { "name": "Dining", "avgFormatted": "$550.00/mo", "rangeFormatted": "$300.00 – $900.00 · ~$6,600/yr projected", "variable": true, "annualFormatted": "~$6,600/yr", "direction": "up" },
          { "name": "Subscriptions", "avgFormatted": "$250.00/mo", "rangeFormatted": "$220.00 – $280.00", "variable": false, "annualFormatted": "", "direction": "up" }
        ] }
      ],
      "rowCount": 7
    }
  },
  "screen": {
    "type": "screen",
    "style": { "background": "$bg" },
    "children": [
      {
        "type": "scroll",
        "children": [
          {
            "type": "vstack",
            "style": { "spacing": 16, "padding": 16 },
            "children": [
              {
                "type": "hstack",
                "style": { "align": "center" },
                "children": [
                  { "type": "text", "binding": "budget.title", "style": { "font": "largeTitle", "weight": "bold", "color": "$textPrimary" } },
                  { "type": "spacer" },
                  { "type": "text", "binding": "meta.updatedAtFormatted", "style": { "font": "caption", "color": "$textSecondary" }, "action": { "type": "refresh" } }
                ]
              },
              {
                "type": "card",
                "style": { "background": "$cardBg", "cornerRadius": 20, "padding": 16 },
                "children": [
                  { "type": "text", "props": { "text": "Avg monthly spend" }, "style": { "font": "subhead", "color": "$textSecondary" } },
                  { "type": "text", "binding": "budget.totalAvgFormatted", "style": { "font": "largeTitle", "weight": "bold", "color": "$textPrimary" } },
                  { "type": "text", "binding": "budget.subtitleFormatted", "style": { "font": "caption", "color": "$textSecondary" } }
                ]
              },
              {
                "type": "text", "binding": "budget.emptyFormatted",
                "style": { "font": "callout", "color": "$textSecondary", "padding": 8 }
              },
              {
                "type": "vstack",
                "props": { "repeat": "budget.buckets" },
                "style": { "spacing": 16 },
                "children": [
                  {
                    "type": "card",
                    "style": { "background": "$cardBg", "cornerRadius": 20, "padding": 16 },
                    "children": [
                      {
                        "type": "hstack",
                        "style": { "align": "center", "spacing": 8 },
                        "children": [
                          { "type": "text", "binding": "item.title", "style": { "font": "headline", "weight": "bold", "color": "$textPrimary" } },
                          { "type": "spacer" },
                          { "type": "text", "binding": "item.subtotalFormatted", "style": { "font": "headline", "weight": "bold", "color": "item.subtotalDirection" } }
                        ]
                      },
                      { "type": "text", "binding": "item.countFormatted", "style": { "font": "caption", "color": "$textSecondary" } },
                      { "type": "divider", "style": { "color": "$divider" } },
                      {
                        "type": "vstack",
                        "props": { "repeat": "item.categories" },
                        "style": { "spacing": 14 },
                        "children": [
                          {
                            "type": "hstack",
                            "style": { "align": "center" },
                            "children": [
                              {
                                "type": "vstack",
                                "style": { "spacing": 2 },
                                "children": [
                                  { "type": "text", "binding": "item.name", "style": { "font": "body", "weight": "semibold", "color": "$textPrimary" } },
                                  { "type": "text", "binding": "item.rangeFormatted", "style": { "font": "caption", "color": "$textSecondary" } }
                                ]
                              },
                              { "type": "spacer" },
                              { "type": "text", "binding": "item.avgFormatted", "style": { "font": "headline", "weight": "semibold", "color": "item.direction" } }
                            ]
                          }
                        ]
                      }
                    ]
                  }
                ]
              }
            ]
          }
        ]
      }
    ]
  }
}
