{
  "schemaVersion": 1,
  "generatedAt": "2026-06-09T14:00:00Z",
  "theme": {
    "colors": {
      "bg": "#0b1020", "bgAccent": "#16204a", "cardBg": "#161c2e",
      "textPrimary": "#f2f5ff", "textSecondary": "#9aa4c4", "accent": "#6ea8fe",
      "up": "#43d18a", "down": "#ff6b6b", "divider": "#2a3350"
    },
    "fonts": { "family": "-apple-system, system-ui, sans-serif" },
    "spacing": 12, "radius": 20
  },
  "nav": [
    { "title": "Home", "icon": "house.fill", "path": "/__APP_NAME_LOWER__" },
    { "title": "Location", "icon": "map.fill", "children": [
      { "title": "Activity", "icon": "map.fill", "path": "/screen/afm" },
      { "title": "48h Transactions", "icon": "clock.arrow.circlepath", "path": "/screen/afm48" }
    ] },
    { "title": "Money", "icon": "dollarsign.circle.fill", "children": [
      { "title": "Balances", "icon": "dollarsign.circle.fill", "path": "/screen/balances" },
      { "title": "YNAB", "icon": "creditcard.fill", "path": "/screen/ynab" }
    ] },
    { "title": "Smart Home", "icon": "house.circle.fill", "path": "/screen/smarthome" },
    { "title": "Config", "icon": "slider.horizontal.3", "path": "/screen/config" }
  ],
  "data": {
    "meta": { "updatedAtFormatted": "Updated just now", "stale": false },
    "afm48": {
      "title": "AFM now",
      "subtitleFormatted": "afm_now_live_mat · 3 rows · as of 2:00 PM",
      "view": "now",
      "tabs": [
        { "key": "now", "label": "Now", "active": true, "color": "$accent", "navHref": "/screen/afm48" },
        { "key": "raw", "label": "48h history", "active": false, "color": "$textSecondary", "navHref": "/screen/afm48?view=raw" }
      ],
      "columns": ["deviceName", "date_time", "latitude", "longitude", "batteryLevel", "batteryStatus"],
      "rows": [
        ["iPhone 16", "20260609_140000", 40.5354, -74.4957, 0.82, "NotCharging"],
        ["iPad Pro", "20260609_135500", 40.4862, -74.4518, 0.91, "Charging"],
        ["Joe's Watch", "20260609_135800", 40.5354, -74.4957, 0.55, "NotCharging"]
      ],
      "rowCount": 3
    }
  },
  "screen": {
    "type": "screen",
    "style": { "background": "$bg" },
    "children": [
      {
        "type": "scroll",
        "children": [
          {
            "type": "vstack",
            "style": { "spacing": 12, "padding": 16 },
            "children": [
              {
                "type": "hstack",
                "style": { "align": "center" },
                "children": [
                  { "type": "text", "binding": "afm48.title", "style": { "font": "largeTitle", "weight": "bold", "color": "$textPrimary" } },
                  { "type": "spacer" },
                  { "type": "text", "binding": "meta.updatedAtFormatted", "style": { "font": "caption", "color": "$textSecondary" }, "action": { "type": "refresh" } }
                ]
              },
              { "type": "text", "binding": "afm48.subtitleFormatted", "style": { "font": "caption", "color": "$textSecondary" } },
              {
                "type": "hstack",
                "props": { "repeat": "afm48.tabs" },
                "style": { "spacing": 8, "wrap": true },
                "children": [
                  { "type": "badge", "binding": "item.label", "style": { "color": "item.color" }, "action": { "type": "navigate", "urlBinding": "item.navHref" } }
                ]
              },
              {
                "type": "card",
                "style": { "background": "$cardBg", "cornerRadius": 20, "padding": 12 },
                "children": [
                  { "type": "table", "binding": "afm48" }
                ]
              }
            ]
          }
        ]
      }
    ]
  }
}
